{
  "channelLinkId": "5e8abc11dec0001a009b",
  "fulfillment": {
    "type": "pickup"
  },
  "items": [
    {
      "menuId": "609a1b2c3d4e5f6a7b8c9d0e",
      "plu": "3F_COMBO",
      "quantity": 2,
      "note": "No salad",
      "subItems": [
        {
          "plu": "A_FRS",
          "customizationPlu": "string",
          "quantity": 1,
          "note": "No salad"
        }
      ]
    }
  ],
  "customer": {
    "name": "Deliverect's Pizza Place",
    "companyName": "Deliverect's Pizza Place",
    "phoneNumber": "+15555550123",
    "email": "customer@example.com",
    "externalId": "609a1b2c3d4e5f6a7b8c9d0e",
    "tin": "string",
    "crmProfileId": "609a1b2c3d4e5f6a7b8c9d0e"
  }
}